,id,text,dom_narr,sub_narr
37,EN_UA_021123.txt,"CIA's Burns & SecDef Austin In Separate 'Urgent' Trips To Ukraine As War Effort Implodes 

 CIA's Burns & SecDef Austin In Separate 'Urgent' Trips To Ukraine As War Effort Implodes

Defense Secretary Lloyd Austin on Monday showed up in Kiev during an unannounced visit, and at an awkward moment for US-Ukraine relations given President Zelensky has been publicly complaining over a decrease in artillery shell supplies, given they are now going to Israel for its war in Gaza.

""I was honored to meet with President @ZelenskyyUa in Kyiv today to reaffirm the United States’ steadfast support for Ukraine,"" Austin wrote on X. ""We, along with our allies and partners, will continue to support Ukraine’s urgent battlefield needs and long-term defense requirements,"" Austin added.

This convenient shift of Washington and the Pentagon to talking mainly about ""long-term defense"" began occurring as it became clear Ukraine's counteroffensive was failing.

But Congress has been dragging its feet on passing Biden's latest supplemental funding requests - again given there's been some wrangling over what gets sent to Israel vs. what's set aside for Ukraine.

This is Austin's second trip to Kiev since the Russian invasion. ""I’m here today to deliver an important message – the United States will continue to stand with Ukraine in their fight for freedom against Russia’s aggression, both now and into the future,"" he said.

Just last week, CIA Director William Burns also made a secretive, unannounced visit to Ukraine to hold urgent meetings with Zelensky and top military and intelligence officials. Commentary in Asia Times has concluded that this flurry of activity is in response to how badly things are going on the battlefield. Washington has invested many tens of billions of dollars into what's clearly a 'proxy war' against Russia. Asia Times wrote:

Wednesday, November 15th is Z-Day for the War in Ukraine. CIA Chief William Burns will arrive in Kiev for urgent, secret meetings with Zelensky. It is worth asking: How come Burns is on an urgent mission to Ukraine?

The answer to the question is that Ukraine is imploding. The crumbling of the Zelensky regime is unsurprising: Ukraine has been sustaining far too many casualties to survive for much longer. Ukraine either must find a way to make a deal with Russia or face an internal rebellion.

Indeed, there have been recent media rumors and rumblings that Washington has begun to quietly push Kiev to the negotiating table. Was this in any way the focus of these new visits by Burns and Austin?

""The Russian strategy is to bleed-down Ukraine’s armed forces and create a political crisis in Kiev,"" the Asia Times report continued. ""The Russian effort is ahead of schedule, which has surprised Moscow as much as Washington.""

Zelensky has lately sacked and replaced many within his own war cabinet. All of this is a sign of deepening friction, also as Zelensky has admitted that the Gaza crisis has taken the international attention off of Ukraine's war efforts. This has led to waning monetary and weapons support as well.","['URW: Discrediting the West, Diplomacy', 'URW: Speculating war outcomes', 'URW: Discrediting Ukraine', 'URW: Discrediting Ukraine']","['URW: Discrediting the West, Diplomacy: West is tired of Ukraine', 'URW: Speculating war outcomes: Ukrainian army is collapsing', 'URW: Discrediting Ukraine: Situation in Ukraine is hopeless', 'URW: Discrediting Ukraine: Discrediting Ukrainian government and officials and policies']"
38,EN_UA_015443.txt,"Ukraine War: Kyiv’s allies fear military support will dry up in US election year 

 Ukraine’s Western allies are concerned that the military support for Kyiv may soon peak, as the US enters a divisive presidential, the Financial Times reported on Thursday, citing unnamed Western officials.

“Ukraine’s allies fear military support for its battle against Russia is nearing a peak, with senior European officials increasingly concerned about the flow of aid next year as the US enters a divisive presidential campaign,” the Financial Times reported.

According to the FT, Washington has been Kyiv’s major source of military aid. US officials interviewed by the newspaper say the remaining funds preapproved by Congress could sustain Ukraine for about another five months. Western officials in regular contact with the US over Ukraine told the FT that Washington sees that period of time as the last real chance for Kyiv to change the situation on the ground.

“We can’t keep the same level of assistance forever,” a European official told the British newspaper as he argued that the current level of support could be sustained for another year or possibly two years but no more.

Politico reported earlier this week that only $6 billion of the original $48 billion military aid package that the US had approved previously now remains. According to the US publication, Washington’s funds for Kyiv may be fully allocated by mid-summer.

European allies are increasingly uncertain about whether the US will come close to matching its existing $48bn package, adopted in 2022, particularly as it requires a vote in Congress this autumn against the backdrop of more partisan debate on the war, FT reported.

Recently, European leaders promised Zelenskyy an arsenal of missiles, tanks and drones during a whirlwind three-day visit to Italy, the Vatican, Germany, France and the U.K. that sought to replenish Ukraine’s depleted weapons supplies ahead of a long-anticipated spring offensive aimed at turning the tide of the war.

Zelenskyy’s energetic international diplomacy over 15 months of war has persuaded Ukraine’s Western allies to send ever more powerful weapons, from German Leopard tanks to U.S. Patriot missile systems and Storm Shadow cruise missiles from the U.K.

The war in Ukraine that began a year ago has killed thousands, forced millions to flee their homes, reduced entire cities to rubble and has fuelled fears the confrontation could slide into an open conflict between Russia and NATO.

With inputs from agencies.

Read all the Latest News , Trending News , Cricket News , Bollywood News , India News and Entertainment News here. Follow us on Facebook , Twitter and Instagram .","['URW: Discrediting the West, Diplomacy', 'URW: Amplifying war-related fears', 'URW: Amplifying war-related fears']","['URW: Discrediting the West, Diplomacy: West is tired of Ukraine', 'URW: Amplifying war-related fears: NATO should/will directly intervene', 'URW: Amplifying war-related fears: By continuing the war we risk WWIII']"
39,EN_UA_024847.txt,"Polish Foreign Minister Reveals Biden Knew About Nord Stream Explosion in Advance 

 The United States knew in advance about the attacks on the Nord Stream pipeline, the largest act of industrial terrorism in history, but did not step in to prevent them, according to an interview with Polish Foreign Minister Radoslaw Sikorski published today.

In September 2022, Sikorski, then a member of the European Parliament (MEP), insinuated that Washington was complicit in the attack on the Nord Stream gas pipeline.

Sikorski tweeted a photo from the scene of the crime and signed it “Thank you, USA.” The MEP also pointed out Joe Biden’s standing threat to demolish the Nord Stream 2 gas pipeline. However, his tweet was deleted just a few hours later.

Speaking with Polish news outlet Rzeczpospolita as the Polish foreign minister his week, Sikorski said “If we believe media, it [the attack] was carried out by someone who was interested in it. And the US had preliminary information about this and did not interfere with this move.”

BYPASS THE CENSORS

Sign up to get unfiltered news delivered straight to your inbox.

You can unsubscribe any time. By subscribing you agree to our Terms of Use

Latest Video

However, Sikorski chose not name those responsible for the crime.

Almayadeen reports: US investigative journalist and Pulitzer award winner Seymour Hersh said on February 8 2023 that US Navy divers planted explosives to destroy the Nord Stream pipelines in 2022.

“Last June, the Navy divers, operating under the cover of a widely publicized mid-summer NATO exercise known as BALTOPS 22, planted the remotely triggered explosives that, three months later, destroyed three of the four Nord Stream pipelines, according to a source with direct knowledge of the operational planning,” Hersh wrote in his Substack newsletter.

The White House responded and dismissed the claims as “false and complete fiction.”

Flightradar24 data showed in late September 2022 that US military helicopters habitually and on numerous occasions circled for hours over the site of the Nord Stream pipeline incident near Bornholm Island.

TRENDING: WEF Insider Reveals The ‘New 9/11’ Will Be a ‘Global Famine’

A US Navy Sikorsky MH-60R Seahawk helicopter spent hours loitering over the location of the damaged natural gas pipelines in the Baltic Sea near Bornholm for several days in a row, September 1, 2, and 3, of 2022 in particular.

Sources familiar with the investigation into the Nord Stream gas pipeline explosions have confirmed media reports that traces lead to Ukraine, Sputnik reported on August 25, 2023.

German media, ZDF and Der Spiegel said that there is no evidence of Russia’s involvement in the pipeline explosions.

The news outlets added that there is growing evidence that agents linked to Ukraine may be behind the attacks on the Nord Stream pipelines. The news outlets noted that they were in Ukraine before and after the explosions in the Baltic Sea, citing technical data.","['URW: Blaming the war on others rather than the invader', 'URW: Discrediting the West, Diplomacy', 'URW: Hidden plots by secret schemes of powerful groups', 'URW: Blaming the war on others rather than the invader']","['URW: Blaming the war on others rather than the invader: The West are the aggressors', 'URW: Discrediting the West, Diplomacy: Other', 'URW: Hidden plots by secret schemes of powerful groups: Other', 'URW: Blaming the war on others rather than the invader: Ukraine is the aggressor']"
40,EN_UA_019640.txt,"After North Korea’s Kim Jong Un, Putin and Xi to meet in Beijing in October, says Kremlin 

 Russian President Vladimir Putin will meet China’s Xi Jinping for talks in Beijing in October, the Kremlin said on Tuesday, Putin’s first known trip abroad since an arrest warrant was issued against him over the deportation of children from Ukraine.

Nikolai Patrushev, a close Putin ally and the secretary of Russia’s Security Council, said Russia and China should deepen cooperation in the face of the West’s attempt to contain them both.

He was quoted by the Interfax news agency as saying that the talks in Beijing would be “thorough”, at a meeting in Moscow with China’s top diplomat, Wang Yi.

Putin will attend the third Belt and Road Forum after an invitation by Xi during a high-profile visit to Moscow in March.

Days before that visit, the International Criminal Court (ICC) issued a warrant for Putin’s arrest on suspicion of illegally deporting hundreds of children or more from Ukraine.

Moscow denies the allegations and the Kremlin said the warrant was evidence of the West’s hostility to Russia, which opened a criminal case against the ICC prosecutor and the judges who issued the warrant.

Russia’s full-scale invasion of Ukraine early last year has triggered one of the deadliest European conflicts since World War Two and the biggest confrontation between Moscow and the West since the 1962 Cuban Missile Crisis.

Putin has pivoted towards China, and Xi has stood by him.

Chinese-Russian trade has soared since the invasion, and Russia has sold Asian powers including China greater volumes of the oil it can no longer sell to the West because of sanctions.

Putin last visited Beijing in February 2022, days before the invasion, where he and Xi announced a ‘no limits’ partnership. Moscow says this does not mean a military alliance, however.

The United States sees China as its gravest long-term “strategic competitor” and Russia as an “acute threat”.

China has refrained from condemning Russia’s operation against Ukraine or calling it an invasion, in line with the Kremlin, which casts the war as a “special military operation”.

Earlier this year, CIA Director William Burns said Russia was becoming more and more dependent on China and was even at risk of becoming its “economic colony” in time.","['URW: Praise of Russia', 'URW: Russia is the Victim']","['URW: Praise of Russia: Russia has international support from a number of countries and people', 'URW: Russia is the Victim: The West is russophobic']"
41,EN_UA_022016.txt,"""Russia does not feel threatened"": Estonian Prime Minister calls for long-range missiles to be transferred to Ukraine 

 Currency

""Russia does not feel threatened"": Estonian Prime Minister calls for long-range missiles to be transferred to Ukraine

Western countries should provide the Armed Forces of Ukraine with all the weapons they need to liberate all the territories seized by Russia. First of all, Kyiv needs to be provided with long-range missiles.

This was the call to the West made by Estonian Prime Minister Kaja Kallas in an interview with The Kyiv Independent published on Sunday, January 14. In her opinion, this is the only way to repel the aggressor country.

The head of the Estonian government reminded that Tallinn had officially decided to provide Kyiv with annual aid of 0.25% of its GDP over the next 4 years. She called on partners and allies to make the same decision.

Kallas said that the joint budgets of the countries that are members of the Ramstein format contact group on Ukraine's defense are ""much larger"" than Russia's budget.

""Every month, Moscow spends about 5.3 billion euros on the war. If we take the total budgets and this 0.25% of the GDP of all the states of the Ramstein coalition, it will be 120 billion. Such assistance would turn the tide in Ukraine's favor. The partners should provide Kyiv with all the military equipment they have,"" said the Estonian prime minister.

The absence of long-range weapons in the Ukrainian army gives the Russian occupation forces an advantage to seize more territories, Kallas noted.

""If they (Russians - Ed.) think they can win, then of course they don't feel threatened and just keep hitting Ukraine,"" the official said.

She also added that some Western countries are afraid that Moscow will lose and what consequences it will have. According to Kallas, the main task now is to end the war.

Speaking in the Estonian parliament on January 11, Ukrainian President Volodymyr Zelensky said that Ukraine must win the battle against Russia because it is about the survival of the Ukrainian people.

As OBOZ.UA previously reported, the head of state called on the West to strengthen support for Ukraine. He emphasized that the Armed Forces of Ukraine need more shells, and they will move forward.

Only verified information is available on OBOZ.UA Telegram channel and Viber. Do not fall for fakes!","['URW: Discrediting the West, Diplomacy', 'URW: Amplifying war-related fears', 'URW: Negative Consequences for the West', 'URW: Overpraising the West']","['URW: Discrediting the West, Diplomacy: The West is weak', 'URW: Amplifying war-related fears: Other', 'URW: Negative Consequences for the West: Other', 'URW: Overpraising the West: The West belongs in the right side of history']"
42,EN_UA_021872.txt,"Kremlin warns of tensions if Poland sends troops to monitor Finnish-Russian border 

 If Finland decides to allow a “concentration” of troops on its border with Russia, it would be viewed by Moscow as a threat, the Kremlin said, after Poland offered to send military advisers to help Helsinki monitor the frontier.

The head of the Polish National Security Bureau, Jacek Siewiera, said in a post on social media X that Poland would send military advisers to its NATO ally Finland, in response to “an official request for allied support in the face of a hybrid attack on the Finnish border”.

“A team of military advisers will provide on-site knowledge on border security, also in operational terms,” he said.

Finland said on Thursday it was unaware of the Polish offer. It has closed its entire 1,340 km (833 mile) border with Russia for two weeks in a bid to halt an unusually large flow of asylum seekers that Helsinki says amounts to a “hybrid attack” orchestrated by Moscow, a charge the Kremlin denies.

Asked about the Polish offer to Finland during a call with reporters, Kremlin spokesman Dmitry Peskov said: “This is an absolutely redundant measure to ensure border security because there is no threat there.”

“The Finns must be clearly aware that this will pose a threat to us - an increase in the concentration of military units on our borders.”

Any planned deployment would be unprovoked and unjustified, said Peskov.

Finland’s Border Guard and the interior ministry both said they were unaware of any plan to bring Polish military advisers to Finland’s eastern border.

Finnish President Sauli Niinisto held talks with his Polish counterpart Andrzej Duda in Warsaw last week but they did not discuss military cooperation on the Finnish border with Russia, Niinisto’s office said in a statement to Reuters.

Finland infuriated Russia earlier this year when it joined NATO, ending decades of military non-alignment, due to the war in Ukraine.","['URW: Blaming the war on others rather than the invader', 'URW: Negative Consequences for the West', 'URW: Discrediting the West, Diplomacy', 'URW: Discrediting the West, Diplomacy']","['URW: Blaming the war on others rather than the invader: The West are the aggressors', 'URW: Negative Consequences for the West: The conflict will increase the Ukrainian refugee flows to Europe', 'URW: Discrediting the West, Diplomacy: The West is overreacting', 'URW: Discrediting the West, Diplomacy: The EU is divided']"
43,EN_UA_016012.txt,"Zinchenko recalls heartbreaking moment wife sobbed as Russia invaded Ukraine as Arsenal star says he WOULD join fight 

 ARSENAL star Oleksandr Zinchenko has recalled the harrowing moment Russia began the invasion of his home country Ukraine.

The Gunners full-back has spoken passionately in the past about the war and the toll it has had on him and his nation as a whole.

Russian president Vladimir Putin sent troops into Ukraine in February 2022.

Now, nearly 18 months on from the beginning of the conflict, Zinchenko has spoken about his memories of how it started.

Speaking on Piers Morgan Uncensored, he said: ""My wife suddenly woke me up. And she said, ‘It started’. I said ‘What started?’ She was crying, you know, like flooding tears.

""I said 'What’s started, what’s wrong?' And she showed me the pictures of this invasion.""

READ MORE ON ARSENAL

Discussing his family and friends in Ukraine, he went on to add: ""I'm so worried about them. And I'll tell you what - the mentality of people they don't want to leave, they don't want to leave the country, even if they could.

""This is their homeland. And I would for sure, after [my] football career, I will be living in Ukraine, that's for sure. One million percent.

""I was there one week ago and as soon as I passed the border it's just my homeland, my place.""

Arsenal man Zinchenko also stated he would fight for his country on the front line - much like fellow sports stars Wladimir Klitschko, Oleksandr Usyk and Vasyl Lomachenko.

Most read in Football

He said: ""There will be a time everyone will be there. It will be the last call or something or whatever. It will be a call.

""We go, all of us, we go there. Everyone will go. Of course [I would fight]. But at the same time I am thinking I am much more helpful from here at the moment.

""But you never know what is going to happen. Maybe this is the last speech we are going to speak to each other. You never know.

""And how many people have already been killed by this invasion? I’m not seeing myself hiding somewhere.""",['Other'],['Other']
44,EN_UA_014413.txt,"Vladimir Putin’s cyber warfare chief sent sex toys after his email is hacked 

 A top Russian military spy has been bombarded with sex toys after his personal email was hacked.

Ukrainian hackers claim they gained access to Sergey Morgachev's AliExpress account, ordering multiple sex toys and gay pride flags in his name.

The embarrassing hack was intended as ""a symbolic act of moral humiliation.""

Morgachev is Vladimir Putin's Lieutenant Colonel at Moscow's chief intelligence office, the GRU.

It is believed he was in charge of Russia's notorious ""Fancy Bear"" hackers, also known as APT28.

The hackers, who call themselves Cyber Resistance, claimed on Telegram that they had managed to break into Morgachev's email account.

Then, they were able to access personal information such as family photos and scanned documents of people associated with him, according to the open-source intelligence site Info Nampalm.

Referring to Morgachev in a message after the theft, the group said ""a very cool and clever hacker, but... We hacked him"".

The hack is considered to appear ""pretty credible"" by Ukrainian hacking expert Stefan Soesanto, of the Swiss Federal Institute of Technology in Zurich.

Info Nampalm reported that the hack confirmed Morgachev's identity by sifting through stolen personnel files.

Among these was a document that showed him to be a department head in Unit 26165.

The Russian hacker was accused by the FBI of holding the same position in 2018.

He is on the FBI's wanted list for his part in hacking senior US Democrats including Hillary Clinton ahead of Donald Trump's presidential election in 2016.

It is said Morgachev and the GRU ""knowingly and intentionally conspired… to gain unauthorised access into the computers of US persons and entities involved in the 2016 US presidential election,"" according to a federal indictment filed by the Department of Justice.

In the document, he is described by the FBI as an officer in Russia's military spy agency, in a department ""dedicated to developing and managing malware.""

This was said to include the ""X-Agent"" spy software used to hack the DNC.

Microsoft later revealed in 2020 that the US election was targeted by the Russian group who launched attacks on people in both the Trump and the Biden campaign.",['Other'],['Other']
45,EN_UA_029155.txt,"Head of German Intelligence Reveals Zelensky Behind Nord Stream Pipeline Attack 

 The former head of German intelligence has revealed that Ukrainian President Volodymyr Zelensky and President of Poland both collaborated to carry out the attack on the Nord Stream Pipelines.

The Nord Stream 1 and 2 pipelines were sabotaged on 26 September 2022 after a series of underwater explosions and gas leaks.

BYPASS THE CENSORS

Sign up to get unfiltered news delivered straight to your inbox.

You can unsubscribe any time. By subscribing you agree to our Terms of Use

Latest Video

Modernity.news reports: Much of the legacy media initially blamed Russia for attack, claiming it was a false flag but offering no sensible reason as to why Moscow would target its own energy infrastructure.

However, during an appearance on German broadcaster WELT-TV, August Hanning, who served as the head of Germany’s Federal Intelligence Service (BND) from 1998 to 2005, the attack was carried out at the behest of Zelensky and Andrzej Duda.

According to Hanning, the act of sabotage occurred as a result of an “agreement between the highest officials in Ukraine and Poland.”

“There were agreements between Zelensky and Duda to carry out the attack,” said Hanning.

As we highlighted yesterday, Germany issued an arrest warrant for a Ukrainian diver believed to be involved in the attack on the Nord Stream pipelines, but Polish authorities failed to stop him at the border and he is now believed to be back in Ukraine.

Berlin issued a European arrest warrant for Ukrainian citizen Volodymyr Z. after identifying him as the chief suspect for placing the explosives that destroyed the pipelines, but Polish authorities claimed they didn’t apprehend the suspect as a result of Berlin not including his name in a database of wanted persons.

The pipeline attack was preceded by warnings from the White House that a Russian invasion of Ukraine would spell the end for Nord Stream 2.

On January 27, 2022, Under-Secretary of State Victoria Nuland stated, “If Russia invades Ukraine, one way or another, Nord Stream 2 will not move forward.”

On February 7, 2022, President Biden said, “If Russia invades… again, then there will be no longer a Nord Stream 2.”

In February 2023, Pulitzer Prize-winning journalist Seymour Hersh published a report asserting that the pipelines were destroyed by the US as part of a covert operation.

According to Hersh’s sources, the explosives were planted in June 2022 by US Navy divers under the guise of the BALTOPS 22 NATO exercise and were detonated three months later with a remote signal sent by a sonar buoy.

It remains to be seen conclusively who ordered and carried out the attack, but the argument that Russia was behind it is looking increasingly tenuous.","['URW: Discrediting Ukraine', 'URW: Distrust towards Media']","['URW: Discrediting Ukraine: Discrediting Ukrainian government and officials and policies', 'URW: Distrust towards Media: Western media is an instrument of propaganda']"
