,id,text,dom_narr,sub_narr
14,EN_UA_014637.txt,"Putin’s masses of HIV-positive prisoners choosing to go to meat-grinder frontline rather than rot in jail with no meds 

 Putin’s masses of HIV-positive prisoners choosing to go to meat-grinder frontline rather than rot in jail with no meds

RUSSIAN prisoners who have tested positive for HIV are choosing to be sent to the frontline hoping to get lifesaving medication.

A large number of Vladimir Putin's HIV-positive prisoner recruits deemed they preferred the battlefield rather than rot in jail where they were denied treatment.

The Wagner Group has been mass-recruiting inmates from Russia's infamous prisons, offering them a pardon if they survive for six months.

Ukrainian officials estimate about 20 per cent of recruits in Russian prisoner units are HIV positive.

And a lot of them were so desperate for the anti-viral medications they couldn't get in jail, they opted to join Putin's bloody war in Ukraine, the New York Times reported.

Speaking from a detention centre in Dnipro, an HIV-positive Russian soldier named Timur, 37, told the newspaper: ""Conditions were very harsh.""

read more in russia

He said how doctors in prison changed the anti-viral medication to a different type that he suspected was not effective.

Fearing he was not going to last his ten-year sentence behind bars, agreed to join Putin's bloodthirsty Wagner Group for six months in exchange for a pardon and supplies of anti-viral medications.

Speaking about the dilemma of poor treatment in prison or fight in Ukraine, he said: ""I understood I would have a quick death or a slow death. I chose a quick death.""

Timur, who had no military experience said he had two weeks of training before being deployed to Bakhmut- where one of the bloodiest battles of the war happened.

Most read in The Sun

He said that the unit's commanders ""repeated many times, ‘if you try to leave this field, we will shoot you.’""

While he was captured, he said that most of the soldiers were killed on their first day.

Another soldier named Ruslan, 42, said he welcomed Wagner's acceptance of HIV-positive inmates and joined the frontline for a chance at medication and freedom.

He said: ""If you have a long sentence, it gives you a chance to begin life again.""

New conscripts in Putin's private army were forced to wear coloured-coded wristbands to signify they had serious infectious diseases such as HIV and hepatitis C.

Earlier this year, Ukraine's Ministry of Defence claimed that Russia marks these ""sick 'fighters' with appropriate bracelets on their hands"".

""In order to 'mark' infected militants, the command of 'Wagners' forces them to wear red bracelets on the arm in case of HIV, and white bracelets in case of hepatitis,"" the Ministry's Main Directorate of Intelligence said in a statement.

The report suggested that Russian conscripts were furious about having to serve alongside ""infected"" militants and military doctors regularly refused to provide assistance to the infected soldiers if they got wounded on the battlefield.

Another HIV prisoner Yevgeny who suffered a gunshot wound before he was captured, said that although he did receive treatment, he felt medics were careless about infecting other patients around him.

He said: ""There were no conditions for the HIV infected.

""We were all treated together, the healthy and the unhealthy.""

READ MORE SUN STORIES

It is estimated a total of 50,000 prisoners have signed up to fight in Ukraine, roughly 10 per cent of the incarcerated population.

Wagner's chief Yevgeny Prigozhin, known as ""Putin's chef"", was pictured trying to recruit inmates from Russia's penal colonies, promising them their freedom in return for six months on the frontline.",['URW: Speculating war outcomes'],['URW: Speculating war outcomes: Russian army is collapsing']
15,EN_UA_021263.txt,"Fetterman drapes himself in Israeli flag during DC rally in support of the Jewish state 

 Fetterman drapes himself in Israeli flag during DC rally in support of the Jewish state

Sen. John Fetterman (D-Pa.) draped himself in an Israel flag as he joined the nearly 300,000 people gathered on the National Mall in Washington, DC, Tuesday in support of the Jewish state as it wages war against Hamas terrorists.

The Pennsylvania Democrat was photographed at the March for Israel rally with the blue and white flag wrapped over his trademark hoodie as he greeted attendees.

Fetterman has been unequivocal in his staunch support of Israel since Hamas’ Oct. 7 terrorist attack despite facing some left-wing backlash over his stance.

“Of course I’m here, how could I not!” Fetterman told one rally-goer, according to an attendee’s X post.

A sharp-eyed X user pointed out that Fetterman used the strings on his hoodie to affix the flag to himself in “the most bipartisan act I’ve ever seen from a Senator.”

Fetterman’s fondness for the Israeli flag triggered several pro-Palestinian protesters outside the US Capitol last week, after the senator emerged from the building waving a small Star of David flag above his head as some demonstrators were being arrested.

“Shame! What a joke!” some of the booing protesters shouted as Fetterman strolled by.

In his office, the senator also displays the posters of the innocent Israelis kidnapped by Hamas terrorists during their deadly raid which also killed 1,200 people.

“They will stay up until every single person is safely returned home,” Fetterman noted in a video posted on X.

Fetterman has also argued against a cease-fire in the conflict, which has reportedly angered some of his supporters and former staffers.

“Now is not the time to talk about a ceasefire. We must support Israel in efforts to eliminate the Hamas terrorists who slaughtered innocent men, women, and children,” the former lieutenant governor of Pennsylvania said in anOct. 18 post on X. “Hamas does not want peace, they want to destroy Israel. We can talk about a ceasefire after Hamas is neutralized.”

Fetterman, however, has remained a harsh critic of congressional Republican efforts to decouple US military aid for Israel from a separate aid proposal for Ukraine as it defends itself against Russia’s invasion.

On Tuesday he called on his GOP colleagues in the upper chamber to cease efforts to pass a stand-alone Israel aid bill.

“Israel and Ukraine are going through existential threats. We need to send aid to BOTH, and my Republican colleagues need to cut the crap,” Fetterman wrote on X.

“This isn’t a game,” he added.","['URW: Discrediting the West, Diplomacy']","['URW: Discrediting the West, Diplomacy: West is tired of Ukraine']"
16,EN_UA_028520.txt,"EU’s top diplomat angry at Hungarian FM for labeling EU ‘pro-war’ 

 Josep Borrell, the EU’s High Representative for Foreign Affairs and Security Policy, called Hungarian Foreign Minister Péter Szijjártó’s accusation that the European Union is “pro-war” completely unacceptable,

“This is totally unacceptable. The European Union is not in favor of war. The European Union is not on the side of war,” Borrell said, adding that the EU is supporting Ukraine in its war against aggression by Russia and wants to end the war in accordance with the UN Charter.

Borrell also said the “unacceptable approach” of the Hungarian government regarding Prime Minister Viktor Orbán’s visit to Moscow and Kyiv would be discussed at a separate meeting on Monday.

Borrell noted that member states should be looking at how investment and funding could help Ukraine, such as by restoring its damaged electricity infrastructure as soon as possible and providing additional air defense systems.

“These are the two most important things right now,” he stressed.

Borrell also commented on the opinion issued by the UN International Court of Justice (ICJ), which was delivered on Friday, according to which Israel’s settlement policy and use of natural resources in the occupied Palestinian territories violate international law and Israel must pay reparations to the Palestinians for the damage caused by the occupation.

He said that these conclusions were largely in line with the EU position, which he said was fully consistent with UN resolutions on the status of the occupied Palestinian territories.

“At a time of continuing and increasing violations of international law, we have a moral duty to reaffirm consistently our unwavering commitment to all the rulings of the International Court of Justice, whatever the case in question,” Borrell said.",['URW: Overpraising the West'],['URW: Overpraising the West: The West belongs in the right side of history']
17,EN_UA_004343.txt,"14/05/2022 Ukrainians show strength at Deaflympics in Brazil 

 Ukrainians show strength at Deaflympics in Brazil

Caxias do Sul (Brazil) (AFP) – When Rymma Filimoshkina practiced the hammer throw in the yard near her house in Mariupol at the start of the Ukraine war, her neighbors thought she was throwing a bomb.

Issued on:

But her ""weapon"" isn't one of destruction: it just won the 33-year-old deaf athlete a gold medal at the Deaflympics in Brazil.

Thousands of kilometers (miles) from the conflict at home, the Ukrainian team is raking in the medals at the Olympics for the deaf, which opened on May 1 and wrap up Sunday in the southern city of Caxias do Sul.

With two days left to go in the Games, Ukraine had a commanding lead in the medal table, with a total of 116 -- more than double the second-place United States.

""In this event, we show the world we exist: we are Ukraine, a real powerful, independent and democratic country,"" said Valeriy Sushkevych, president of the Ukraine Paralympic committee.

""One soldier called us and said: in between battles, we support you on TV. Your fighting spirit in sports is very important for us,"" he told AFP.

'Really want' peace

Ukraine has a history of punching above its weight in disabled sport.

Its Paralympic program owes its success to two and a half decades of specialized schools in every region of the country for children with disabilities, who start participating in sporting programs at an early age, Sushkevych says.

Ukraine finished sixth in the medal table at the Summer Paralympics in Tokyo last year, and second at the Winter Paralympics in Beijing in March, just after Russia launched its invasion.

The team's success at the Deaflympics is symbolically charged: Ukraine had finished second in the medal table at the last three editions of the event -- behind Russia, which was banned from all international competitions over the invasion.

""I dedicate these medals to Ukraine. I'm very proud to represent my country,"" said a smiling Dmytro Levin, a 24-year-old native of Kharkiv, speaking in sign language after winning two golds and a bronze in orienteering.

""I'm happy to have won this medal for Ukraine. But all I really want is peace,"" said 15-year-old Sofia Chernomorova, who won bronze in badminton.

'Didn't hear the sirens'

Filimoshkina said she still remembers the vibrations she felt with every bomb that exploded in Mariupol, the port city devastated by relentless Russian strikes.

""A lot of deaf people died because they didn't hear the air raid sirens and went outside at the wrong time,"" she said.

Her teammate Julia Kysylova, who won silver in the hammer throw, said that for a long time, she was sure they would have to cancel their trip for the Games.

""When the war erupted, it was impossible to train. I spent a month sheltering at home,"" said the 25-year-old athlete from Nova Kakhovka, in the hard-hit southern region of Kherson.

She finally managed to flee to Spain, leaving her husband behind.

""It was a miracle we managed to cross the border. The trip took more than two days,"" she said.

""After the Games, I hope to go back home and be with my husband,"" she added.

""But I don't know if that will be possible.""

© 2022 AFP",['Other'],['Other']
18,EN_UA_013617.txt,"Filling the Blank Spots in Our National History 

 by Ron Unz, The Unz Review:

The Truth About the JFK Assassination, the 9/11 Attacks, and the Holocaust

Back in 1959 Vice President Richard Nixon visited Moscow and held his famous “Kitchen debate” with Soviet leader Nikita Khruschev. Nixon favorably compared the standard of living of American suburbanites to that of their Russian counterparts under Communism.

Criticizing Soviet society was a serious crime in those days, but I doubt that the Russians ever considered arresting Nixon and giving him a ten year stretch in the gulag for “anti-Soviet agitation.” Not even Maoist China at the height of its Cultural Revolution would have considered such a thing.

TRUTH LIVES on at https://sgtreport.tv/

But late last week, on the eve of a Russia-China leadership summit in Moscow, Europe’s International Criminal Court (ICC) in the Hague issued an arrest warrant for Russian President Vladimir Putin, the man who controls the world’s largest nuclear arsenal, whose striking power is further enhanced by its revolutionary hypersonic delivery systems.

The charges against Putin were that he had ordered the humanitarian evacuation of children from the dangerous Ukraine warzone, and the ICC also ordered the arrest of Maria Lvova-Belova, the Russian Commissioner for Children’s Rights.

Yet oddly enough, no ICC action had ever been taken against American Secretary of State Madeleine Albright, who had famously declared in 1996 that the deaths of 500,000 Iraqi children brought about by the American economic sanctions she supported was “worth it.”

Indeed, in 2016 National Security Advisor John Bolton leveled harsh threats against ICC judges if they dared take legal action against any Americans accused of torture and murder, and many have noticed the strange lack of ICC even-handedness over the years.

The International Criminal Court that we don’t recognize has issued an arrest warrant against Putin for evacuating children from a Warzone that is getting shelled with our weapons and we are the ones who killed over 20 million people in 37 victim nations since WW2. pic.twitter.com/e8ffVvChbN

— Kim Dotcom (@KimDotcom) March 18, 2023

But issuing a press release or even an arrest warrant does not necessarily determine events in real life, and the Moscow summit between Putin and Chinese leader Xi Jinping has hardly been disturbed. Taken together, Russia and China control a substantial fraction of the world’s natural resources and industrial capacity, and although their global propaganda presence is weak, those former factors are more important as elements of real world power.

As an example of this, last week Saudi Arabia and Iran, two of the most important Middle Eastern countries, announced in Beijing that after negotiations held under Chinese auspices they had reestablished diplomatic relations despite many years of bitter hostility:

- Russia, China, Iran…and Saudi Arabia?

Ron Unz • The Unz Review • March 13, 2023 • 3,200 Words

Over the last few months, America and its Western allies have declared their unilateral right to set a cap on the price Russia charges for its oil, seeking to use their dominance over the international financial infrastructure to reduce Russian revenue on its sale of natural resources to other countries.

Russia and Saudi Arabia are two of the world’s leading oil exporters, and with the latter nation now having dramatically shifted towards the Russia-China alliance, its leadership recently declared that they would ban sales to any country that sought to impose a price cap on its oil.","['URW: Praise of Russia', 'URW: Russia is the Victim', 'URW: Discrediting the West, Diplomacy', 'URW: Russia is the Victim', 'URW: Praise of Russia', 'URW: Praise of Russia']","['URW: Praise of Russia: Praise of Russian military might', 'URW: Russia is the Victim: Russia actions in Ukraine are only self-defence', 'URW: Discrediting the West, Diplomacy: Other', 'URW: Russia is the Victim: The West is russophobic', 'URW: Praise of Russia: Other', 'URW: Praise of Russia: Russia has international support from a number of countries and people']"
19,EN_UA_024050.txt,"How NATO powers are using the U.K.’s World War I model to lure Russia into the next big global war 

 by Leo Hohmann, Leo Hohmann:

Using duplicity, deception and secret alliances, the U.K.’s inner circle of top elites led by Nathaniel Rothschild, King Edward VII, and Lord Alfred Milner backed the German Kaiser into a corner and intentionally set the Germans up to blame them for starting the First World War, when in fact it was the British who provoked the Germans to the point where war was the only option.

German generals were caught strategizing several weeks ago on how to bomb Russia’s main bridge to Crimea. This would be an act of aggression that Russian President Vladimir Putin described as guaranteed to draw a harsh military response from Russia, possibly even including a nuclear strike against Berlin.

TRUTH LIVES on at https://sgtreport.tv/

And that has led to an admission by German officials that their military is woefully unprepared to take on Russia. If German generals and politicians truly want to provoke a war with Russia, they had better slow down and wait for their military to catch up to the political rhetoric coming out of Berlin.

A March 14 article by John Cody at Remix News shows that the German Army lacks the personnel, equipment and infrastructure to wage a major war of any kind, let alone with a nuclear-armed military superpower like Russia.

“Germany’s own military and government are painting such a dire picture of the armed forces that there are now calls from some of the most powerful politicians in the country to reinstate mandatory military service,” Cody writes.

Yes, a military draft.

A video produced by Remix News details testimony provided by Eva Högl, German Parliamentary Commissioner for the Armed Forces, who provided catastrophic details about the state of the German military. It is shocking in terms of its candor regarding the current state of the German armed forces.

NEW: 🇩🇪 Germany may bring back the DRAFT.

The country’s army is falling apart, and the government now openly admits it. pic.twitter.com/KxwKPwDdSd

— Remix News & Views (@RMXnews) March 13, 2024

She finds it “really impressive” that Germany has emptied out its military defense stocks by handing it over to Ukraine to be wasted in a losing war with Russia. That sounds like an admission of treason in the wide open.

But wait. There’s more.

Germany knows it is incapable of taking on Russia so it is negotiating a secret deal with the insane leaders of two other European countries, France and Poland, for the very purpose of sending troops into Ukraine separate from NATO, although I do not believe this could truly be done without the acquiescence of Washington and London.

An organization called the Weimar Triangle – composed of France, Germany and Poland – has been in existence since 1991 at the fall of the Soviet Union.

The stated purpose of the Weimar Triangle was to assist Poland’s emergence from Communist rule. It’s strange that it still exists but it may have found a new purpose – instigating World War III with Russia.

According to Wikipedia, “the Weimar Triangle exists mostly in the form of summit meetings between the leaders of the three countries and of their foreign ministers. The collaboration between member states includes inter-parliamentary contacts, military, scientific and cultural co-operation. The most recent summit of leaders occurred in Paris on June 12, 2023.” (Emphasis mine)","['URW: Blaming the war on others rather than the invader', 'URW: Amplifying war-related fears', 'URW: Amplifying war-related fears', 'URW: Praise of Russia', 'URW: Discrediting the West, Diplomacy', 'URW: Amplifying war-related fears']","['URW: Blaming the war on others rather than the invader: The West are the aggressors', 'URW: Amplifying war-related fears: Russia will also attack other countries', 'URW: Amplifying war-related fears: There is a real possibility that nuclear weapons will be employed', 'URW: Praise of Russia: Praise of Russian military might', 'URW: Discrediting the West, Diplomacy: The West is weak', 'URW: Amplifying war-related fears: By continuing the war we risk WWIII']"
20,EN_UA_004209.txt,"Russia threatens nukes for US, UK, Finland if NATO expands 

 Russia threatens nukes for US, UK, Finland if NATO expands

Vladimir Putin warned the president of Finland Saturday that any effort to join NATO would “negatively” affect relations between the two countries.

The comments followed another Russian leader’s threat to use the Satan-2 hypersonic nuclear missile to strike Britain and Finland “in just 200 seconds” — and that the weapons could be used to hit the United States as well.

As NATO foreign ministers gathered in Berlin, with discussion about potential applications from Sweden and Finland to join the Western military alliance on the agenda, Putin spoke to Finnish leader Sauli Niinisto.

Nijnisto told Putin in the phone conversation that the traditionally non-aligned country “will decide to apply for NATO membership in the coming days.”

Finland and Sweden, also traditionally neutral, are moving toward the applications in response to Russia’s invasion of Ukraine. In response, Russia cut off electricity supplies to Finland on Friday.

Putin told Niinisto that Finland’s abandonment “of its traditional policy of military neutrality would be an error since there are no threats to Finland’s security,” the Kremlin said in a statement issued after the call. “Such a change in the country’s foreign policy could negatively affect Russian-Finnish relations, which had been built in the spirit of good neighborliness and partnership for many years, and were mutually beneficial.”

Niinisto’s office said in a statement that he told Putin how starkly Finland’s security environment had changed after Moscow’s Feb. 24 invasion of Ukraine.

The exchange came amid escalating rhetoric over the potential for NATO to expand beyond its current 30 members.

“If Finland wants to join this bloc, then our goal is absolutely legitimate — to question the existence of this state. This is logical,” said Aleksey Zhuravlyov, 59, the deputy chairman of the Russian parliament’s defense committee, said in an interview with The Mirror. “The Finns in general should be grateful to Russia for their statehood, for the fact that Finland exists as a country.”

“If the United States threatens our state, it’s good: here is the Sarmat [Satan-2] for you, and there will be nuclear ashes from you if you think that Russia should not exist,” he continued. “And Finland says that it is at one with the USA. Well, get in line.”

The Satan-2 is a ballistic missile capable of carrying 10 to 15 nuclear warheads, with an estimated destructive power of three megatons each.

Russia wouldn’t need to move nukes to its European border to carry out its threat, officials boasted.

“We can hit with a Sarmat [known in the West as Satan-2] from Siberia, and even reach the UK,” he said. “And if we strike from Kaliningrad … the hypersonic’s reaching time is 200 seconds – so go ahead, guys.

“On the Finnish border we will have not strategic weapons, but Kinzhal-class, one that will reach Finland in 20 seconds, or even 10 seconds.”

Separately, Deputy Foreign Minister Alexander Grushko said Russia knows that NATO wants to “militarize everything within reach,” Interfax news agency reported.","['URW: Amplifying war-related fears', 'URW: Blaming the war on others rather than the invader']","['URW: Amplifying war-related fears: There is a real possibility that nuclear weapons will be employed', 'URW: Blaming the war on others rather than the invader: The West are the aggressors']"
