,id,text,dom_narr,sub_narr
29,EN_UA_014829.txt,"Why the Media Don’t Want to Know the Truth About the Nord Stream Blasts 

 by Jonathan Cook, The Unz Review:

No one but the terminally naïve should be surprised that security services lie – and that they are all but certain to cover their tracks when they carry out operations that either violate domestic or international law or that would be near-universally rejected by their own populations.

Which is reason enough why anyone following the fallout from explosions last September that ripped holes in three of the four Nord Stream pipelines in the Baltic Sea supplying Russian gas to Europe should be wary of accepting anything Western agencies have to say on the matter.

TRUTH LIVES on at https://sgtreport.tv/

In fact, the only thing that Western publics should trust is the consensus among “investigators” that the three simultaneous blasts deep underwater on the pipelines – a fourth charge apparently failed to detonate – were sabotage, not some freak coincidental accident.

Someone blew up the Nord Stream pipelines, creating an untold environmental catastrophe as the pipes leaked huge quantities of methane, a supremely active global-warming gas. It was an act of unrivaled industrial and environmental terrorism.

If Washington had been able to pin the explosions on Russia, as it initially hoped, it would have done so with full vigor. There is nothing Western states would like more than to intensify world fury against Moscow, especially in the context of NATO’s express efforts to “weaken” Russia through a proxy war waged in Ukraine.

But, after the claim made the rounds of front pages for a week or two, the story of Russia destroying its own pipelines was quietly shelved. That was partly because it seemed too difficult to maintain a narrative in which Moscow chose to destroy a critical part of its own energy infrastructure.

Not only did the explosions cause Russia great financial harm – the country’s gas and oil revenues regularly financed nearly half of its annual budget – but the blasts removed Moscow’s chief influence over Germany, which had been until then heavily dependent on Russian gas. The initial media story required the Western public to believe that President Vladimir Putin willingly shot himself in the foot, losing his only leverage over European resolve to impose economic sanctions on his country.

But even more than the complete lack of a Russian motive, Western states knew they would be unable to build a plausible forensic case against Moscow for the Nord Stream blasts.

Instead, with no chance to milk the explosions for propaganda value, official Western interest in explaining what had happened to the Nord Stream pipelines wilted, despite the enormity of the event. That was reflected for months in an almost complete absence of media coverage.

When the matter was raised, it was to argue that separate investigations by Sweden, Germany and Denmark were all drawing a blank. Sweden even refused to share any of its findings with Germany and Denmark, arguing that to do so would harm its “national security.”

No one, again including the Western media, raised an eyebrow or showed a flicker of interest in what might be really going on behind the scenes. Western states and their compliant corporate media seemed quite ready to settle for the conclusion that this was a mystery cocooned in an enigma.

Isolated and friendless

It might have stayed that way forever, except that in February, a journalist – one of the most acclaimed investigative reporters of the past half-century – produced an account that finally demystified the explosions. Drawing on at least one anonymous, highly placed informant, Seymour Hersh pointed the finger for the explosions directly at the US administration and President Joe Biden himself.","['URW: Hidden plots by secret schemes of powerful groups', 'URW: Russia is the Victim', 'URW: Distrust towards Media', 'URW: Discrediting the West, Diplomacy']","['URW: Hidden plots by secret schemes of powerful groups: Other', 'URW: Russia is the Victim: The West is russophobic', 'URW: Distrust towards Media: Western media is an instrument of propaganda', 'URW: Discrediting the West, Diplomacy: The EU is divided']"
30,EN_UA_021918.txt,"US, China, Israel and others are developing AI killer drones; this poses significant risks 

 by Rhoda Wilson, Expose News:

The Pentagon’s recent developments in AI technology have drawn concern and criticism as they approach the deployment of autonomous AI weapons systems capable of making lethal decisions independently.

The New York Times reports that countries such as the United States, China and Israel are actively working on lethal autonomous weapons empowered by artificial intelligence (“AI”), which can autonomously identify and engage targets.

TRUTH LIVES on at https://sgtreport.tv/

Critics argue that the use of AI-controlled drones with the ability to autonomously kill humans is a highly alarming development, as it places life-or-death choices on machines with minimal human oversight. Several countries, including Russia, Australia and Israel are opposing efforts by other nations to pass a binding resolution at the United Nations calling for a ban on AI killer drones.

The issue surrounding the deployment of AI weapons has sparked intense debate, with key questions revolving around the role of human agency in the use of force. Austria’s chief negotiator on the matter, Alexander Kmentt, emphasised that this issue is not just a security and legal concern but also an ethical one.

Meanwhile, the Pentagon has revealed plans to deploy swarms of AI-enabled drones as part of their AI weapons programme. These drones, equipped with advanced AI capabilities, are intended to provide the United States with a tactical advantage, countering the numerical superiority of China’s Liberation Army.

US Deputy Secretary of Defence Kathleen Hicks further highlighted the role of AI-controlled drone swarms in reshaping battlefield dynamics, making them harder to plan against, hit and defeat. However, concerns arise regarding human supervision and decision-making capabilities, as some argue that limitations on AI’s autonomy could hinder strategic advantages.

Critics also point to recent incidents where AI drones have been utilised in conflict zones, such as Ukraine’s use of AI-controlled drones during its conflict with Russia. The extent of human casualties caused by these AI drones remains uncertain, raising additional concerns.

Advocacy groups like the Campaign to Stop Killer Robots warn that AI technology’s dehumanisation poses significant risks. This dehumanisation could not only impact the use of force but also permeate other aspects of our lives, extending to automation in law enforcement, smart homes, and beyond. The campaign notes the urgent need for a global treaty banning autonomous weapons to prevent the wide-scale production and proliferation of these technologies from potentially falling into the wrong hands.",['Other'],['Other']
31,EN_UA_018789.txt,"Rouble weakens to 17-month low past 100 against dollar 

 By 0724 GMT, the rouble was 1.4 percent weaker against the dollar at 100.84, passing the 100 threshold for the first time since March 23, 2022.

he rouble slumped to 100 against the dollar on Monday, hitting three figures for the first time in almost 17 months, struggling under the weight of strong foreign exchange demand and Russia's shrinking balance of trade.

By 0724 GMT, the rouble was 1.4 percent weaker against the dollar at 100.84, passing the 100 threshold for the first time since March 23, 2022.

It lost 1.5 percent to trade at 110.44 versus the euro, also a near 17-month low, and shed 1.3 percent against the yuan to 13.87.

The rouble has chartered a turbulent course since Russia invaded Ukraine in February 2022, slumping to a record low of 120 against the dollar in March last year before recovering to a more than seven-year high a few months later, supported by capital controls and surging export revenues.

Russia's central bank has blamed the rouble's weakening on falling export revenues and recovering imports, but a Kremlin aide on Monday said loose monetary policy was to blame, a sign of discord among Russia's monetary authorities.

Brent crude oil LCOc1, a global benchmark for Russia's main export, was down 0.9% at $86.05 a barrel, not far from a more than seven-month high hit last week.

The rouble, already under pressure amid robust demand for foreign currency and limited supply from exporting firms, has failed to benefit from strong oil prices.

A trader at a large Russian bank told Reuters the market was confused: ""Everyone is ready for the inflow of revenues from expensive oil, but it seems to be hanging somewhere, and our regulators are somehow indifferent, there is nothing to rely on.""

Russian stock indexes were higher.

""The unstoppable and puzzling growth of the USD/RUB rate...continues to support retail investors' interest in equities as a way to save their depreciating rouble savings,"" said Sinara Investment Bank in a note.

The dollar-denominated RTS index .IRTS was up 0.2 percent to 1,002.7 points. The rouble-based MOEX Russian index was 1.6 percent higher at 3,205.4 points, at a pre-invasion high.

Share your experiences, suggestions, and any issues you've encountered on The Jakarta Post. We're here to listen.

Thank you for sharing your thoughts. We appreciate your feedback.",['Other'],['Other']
32,EN_UA_003579.txt,"International agencies call for urgent aid to address food insecurity 

 The Russian invasion of Ukraine, and Western sanctions on Moscow, have sent energy and food prices soaring in recent weeks, while rising natural gas prices also have impacted fertilizer production, which in turn hurts farmers.

ajor international organizations issued an appeal Wednesday for urgent measures to deal with rising food insecurity in poor countries, including financing to support farmers and increase food supplies.

The Russian invasion of Ukraine, and Western sanctions on Moscow, have sent energy and food prices soaring in recent weeks, while rising natural gas prices also have impacted fertilizer production, which in turn hurts farmers.

""It is critical to quickly provide support for food insecure countries in a coordinated manner,"" the heads of the IMF, World Bank, World Trade Organization and UN World Food Program said in a joint statement.

Protests have erupted in some countries over high prices, and the statement said, ""The increase in food prices and supply shocks can fuel social tensions in many of the affected countries, especially those that are already fragile or affected by conflict.""

The organizations called on the international community to provide financing for emergency food supplies, a safety net for poor families and farmers, and to increase agricultural production.

They also called for ""open trade"" that avoids export restrictions or ""humanitarian food purchases.""

While the poor nations are most vulnerable to the crisis, middle income countries increasingly are at risk, the statement said.

""Surging fertilizer prices along with significant cuts in global supplies have important implications for food production in most countries, including major producers and exporters, who rely heavily on fertilizer imports,"" they said.

IMF chief Kristalina Georgieva, World Bank President David Malpass, WTO head Ngozi Okonjo-Iweala and WFP director David Beasley issued the statement before next week's meeting of the IMF and World Bank.

Increased fragility

The war in Ukraine came as the global economy was trying to right itself following the COVID-19 pandemic, while navigating supply chain snarls that created shortages and a surge in inflation.

New lockdowns in China have added further uncertainty to the recovery.

Ukraine is a key source of grain while Russia is a major producer of energy and fertilizer needed for agriculture.

Protestors in Peru have taken to the streets to demand government action, as did people in Sri Lanka, where the government on Tuesday announced it was defaulting on its US$51 billion in foreign debt.

Poverty rose sharply during the pandemic, and the World Bank warns that for each one percentage point increase in food prices, 10 million people are thrown into extreme poverty worldwide.

""Sharply higher prices for staples and supply shortages are increasing pressure on households worldwide and pushing millions more into poverty,"" the officials said.

""Increased fragility and conflict pose persistent harm to people around the globe.""

Share your experiences, suggestions, and any issues you've encountered on The Jakarta Post. We're here to listen.

Thank you for sharing your thoughts. We appreciate your feedback.",['URW: Negative Consequences for the West'],['URW: Negative Consequences for the West: Sanctions imposed by Western countries will backfire']
33,EN_UA_000104.txt,"Senate blocks sanctions aimed at stopping Nord Stream 2 pipeline 

 The Senate blocked a measure to impose new sanctions on the Nord Stream 2 gas pipeline from Russia to Germany after the Biden administration warned it could disrupt allied unity in the confrontation over Ukraine.

The measure by Republican Senator Ted Cruz of Texas failed on a vote of 55 to 44. It needed 60 votes to pass.

The vote was held open for several hours as Democrats grappled with a setback on unrelated voting rights legislation.

“Russia has nakedly and unequivocally used energy as energy blackmail,” Cruz said Thursday on the Senate floor. President Vladimir Putin has done that “openly, brazenly and laughingly and absolutely nothing happened,” Cruz said.

Opponents of the measure said it would damage U.S. cooperation with Germany and other NATO partners as they try to head off a potential invasion of Ukraine by Putin’s forces deployed on its borders.

The bill “would undermine the current diplomatic situation,” said Senator Jeanne Shaheen, a New Hampshire Democrat who had introduced earlier sanctions proposals with Cruz. “We are in a very different situation right now” than when two earlier bills were passed.

The Biden administration also has argued that imposing new sanctions on the undersea pipeline now could undercut the US’s ability to persuade other European nations to join in severe economic penalties later if Russia invades Ukraine.

The legislation “will not counter further Russian aggression or protect Ukraine,” Emily Horne, a spokesperson for the National Security Council, said in a statement Wednesday. “Instead, it will undermine our efforts to deter Russia and remove leverage the United States and our allies and partners possess in this moment all to score political points at home.”

The White House backed an alternative plan from Senator Bob Menendez, the New Jersey Democrat who heads the Foreign Relations Committee, that would make the sanctions contingent on Russia’s actions in Ukraine. Nearly 40 senators have signed on to that bill.

But Senate Minority Leader Mitch McConnell said that the pipeline is what’s divisive. Unlike an older Nord Stream pipeline, the new one bypasses Ukraine.

“The government of Germany should have shelved this project itself a long time ago,” McConnell said. “These sanctions, like the prior Nord Stream 2 sanctions that had overwhelming bipartisan support here in Congress, are not about driving a wedge in Europe. The pipeline itself is the wedge.”

McConnell called for a stronger stance against Russia, saying on the Senate floor that the US should extend additional humanitarian and military support to Ukraine.

“We must not pull our punches out of some fear of provoking Putin,” he said. “What will encourage Putin is if he senses American weakness.”

Construction of the new pipeline is essentially complete, but Germany has yet to issue the certification required for it to begin operating.

©2022 Bloomberg L.P.",['Other'],['Other']
34,EN_UA_001032.txt,"Russia-Ukraine war map: Where are Russian troops positioned around Ukraine? 

 RUSSIA is demanding the surrender of Mariupol, while trying to position themselves within range of crucial cities.

At least eight civilians have died in a Russian attack on a large shopping centre just outside the Ukraine's capital Kyiv.

Where are Russian troops in Ukraine now?

An estimate of 190,000 Russian troops have been deployed in and around Ukraine for the invasion.

Russia has admitted around 10,000 of their troops have been killed.

Despite peace talks on the Belarusian border, the Ukraine war rages on with no hint of whether Russian President Vladimir Putin will withdraw his troops.

Russia has military control over much of Ukraine's southern regions but is fighting to take control of Mariupol.

read more on the ukraine war

The city is surrounded by Russian forces but Ukraine refuses to surrender.

Ukrainian forces are holding on to important cities like Kharkiv and Kyiv as well as Odesa, which is a crucial connection to supplies.

Capital Kyiv remains under Ukrainian control with the nearest Russian troops about 15 miles from the city centre.

Troops attacked the Retroville mall just outside Kyiv in the Podilskyi district, killing eight civilians.

In the north of the country, Russian troops are attempting to surround the city of Sumy.

Many civilians have joined Ukrainian forces in the fight for their homeland.

RUSSIA LATEST

Which parts of Ukraine has Russia invaded?

Russia has made large sweeps in the south of Ukraine, using Crimea and the separatist supporters in Donetsk and Luhansk.

Troops moved into the Kherson region from Crimea - a territory that Russia annexed from Ukraine in 2014.

Kherson and Melitopol areas of Ukraine are under control of Russian forces.

There is strong Russian presence in Chernobyl and the surrounding area.

Northern cities of Chernihiv and Konotop, which are closest to the Russian and Belarusian borders, have also been taken.

🔵 Read our Russia - Ukraine live blog for the very latest updates

Why has Russia invaded Ukraine?

Unrest in the Donbas region began in 2014 after the Russian annexation of Crimea.

Pro-Russian demonstrations escalated into fighting with the Ukraine government forces.

The Minsk agreement of 2015 – between the separatist leaders, Ukraine, Russia, France and Germany – sought to end fighting in the region but without success.

The much feared Russian advance began in the early hours on February 21, 2022, soon after Putin announced he recognised Luhansk and Donetsk as independent states in a bombastic TV address.

Joe Biden and Boris Johnson condemned the move as an ""invasion"" and slapped sanctions on Russian banks and Putin's billionaire cronies.

READ MORE SUN STORIES

Read More on The Sun

Many countries and private companies have also sanctioned Russia and Russian oligarchs, such as Chelsea FC owner Roman Abramovich.

The big sanctions for the billionaires has been the seizures of many of their superyachts.","['URW: Discrediting the West, Diplomacy']","['URW: Discrediting the West, Diplomacy: Diplomacy does/will not work']"
35,EN_UA_013344.txt,"I was a KGB spy along side Putin and he IS using body doubles – these simple signs are a dead giveaway that he’s a fake 

 A FORMER spy alleges a body double stands in for Vladimir Putin at key events – and has revealed what he says are the tell-tale signs.

Sergei Zhirnov claims to have served alongside the Russian tyrant in the KGB intelligence service of the former Soviet Union, which is now known as the FSB.

Zhirnov said he had believed until now that claims of Putin using doppelgangers were “conspiracy theories”.

But he has now changed his mind, citing a speech made by a “skinny” and coughing Putin on February 21 and contrasting it with an appearance at a pro-war concert next day in Moscow as evidence.

Footage highlights him waving his hands around and repeatedly touching his nose, not traits especially common with Putin.

Zhirnov told Ukrainian TV that “a totally different Putin pops up” with “a wider face as if he bloated in 24 hours”.

READ MORE ON VLADIMIR PUTIN

""He has a totally different shape of eye orbits, a totally different head, absolutely different wrinkles - a different voice.”

Far from shunning people, perhaps to avoid Covid, he was “almost kissing and hugging everyone”.

His allegation comes as a video shows an unusually exuberant Russian president at a helicopter plant in Siberia.

Zhirnov is now exiled in France and was a former classmate of Putin at KGB Red Flag Institute, a spy training centre.

Most read in The Sun

The claim Putin uses a body double has also been made by the head of Ukrainian military intelligence.

Major General Kyrylo Budanov claimed the body doubles are used to hide Putin’s loss of control in the Kremlin.

He claimed Ukrainian secret services detected Putin body doubles standing in for him on a number of ""special occasions"" in the past, but this had become ""usual practice"" now

""We know specifically about three people that keep appearing, but how many there are, we don't know,"" Budanov said.

""They all had plastic surgery to look alike.""

The spy chief alleged all the doubles had surgery but said the one thing that gives them away is their height.

“It's visible in videos and pictures. Also gesturing, body language and earlobes, since they are unique for every person.""

The claim that Putin uses body doubles is also regularly made by the General SVR Telegram and YouTube channel, which claims to be run by a Kremlin insider.

Most experts dismiss such claims as absurd and far-fetched, though several noticed Putin’s unusually buoyant mood in Siberia, compared to recent public appearances in Moscow.

One claim was that Putin had had an extra dose of medicine.

It has been alleged body doubles were used by former Soviet leaders Josef Stalin and Leonid Brezhnev.

Putin three years ago admitted that officials had considered using doubles, but he claimed the idea was rejected.

""I discarded the idea of any doubles,” he said.

He admitted the idea came up in the early 2000s when Russia was hit by terrorist attacks.

It was suggested a lookalike should take his place at events where the head of state might be at risk, he said.

READ MORE SUN STORIES

“This was during the toughest time of our war against terrorism.”",['URW: Hidden plots by secret schemes of powerful groups'],['URW: Hidden plots by secret schemes of powerful groups: Other']
36,EN_UA_027787.txt,"Russia Says US Is Responsible for Deadly Ukrainian Attack on Crimea 

 MOSCOW—Russia said on Sunday that the United States was responsible for a Ukrainian attack on Crimean peninsula with five U.S.–supplied missiles that killed four people, including two children, and injured 151 more.

The Russian Defence Ministry said four of the U.S.–delivered Army Tactical Missile System (ATACMS) missiles, equipped with cluster warheads, were shot down by air defense systems and the ammunition of a fifth had detonated in mid-air.

Footage on Russian state television showed people running from a beach and some people being carried off on sun loungers.

Russian authorities in Crimea said missile fragments had fallen just after noon near a beach on the north side of the city of Sevastopol where locals were on holiday.

The incident generated a furious reaction among Russian public figures.

The Defense Ministry said U.S. specialists had set the missiles’ flight coordinates on the basis of information from U.S. spy satellites, meaning Washington was directly responsible.

“Responsibility for the deliberate missile attack on the civilians of Sevastopol is borne above all by Washington, which supplied these weapons to Ukraine, and by the Kyiv regime, from whose territory this strike was carried out,” the ministry said.

Russia sent its troops into Ukraine on Feb. 24, 2022.

The United States began supplying Ukraine with longer range ATACMS missiles, which have a 300-kilometre (186-mile) range, earlier this year.

Treating the InjuredSevastopol Governor Mihail Razvozhaev put the death toll at four, with 144 injured, including 82 taken to hospitals. Twenty-seven children were among the injured.

Specialist doctors were being flown in from other parts of Russia.

Russia will respond to Sunday’s attack, the Defense Ministry said, without elaborating. The Kremlin said President Vladimir Putin had been “in constant contact with the military” since the attack.

Dmitry Medvedev, Deputy Chairman of the Security Council, described the incident as “a vile, despicable act against our people.”

He likened it to attacks carried out by gunmen on Sunday against a synagogue, a church, and police post in Dagestan and said there was “no difference to us” between the U.S. administration, Ukrainian leaders, and “crazy fanatics.”

Russian Orthodox Patriarch Kirill said there “was no justification whatsoever for a missile strike on civilians” and expressed indignation that the incident occurred on the Orthodox holiday of Trinity.

Neither Ukraine nor the United States has commented on the attack, which came on a day when Ukraine said one person had been killed and 10 others wounded by Russian strikes on the eastern Ukrainian city of Kharkiv.","['URW: Blaming the war on others rather than the invader', 'URW: Blaming the war on others rather than the invader', 'URW: Russia is the Victim', 'URW: Russia is the Victim']","['URW: Blaming the war on others rather than the invader: The West are the aggressors', 'URW: Blaming the war on others rather than the invader: Ukraine is the aggressor', 'URW: Russia is the Victim: UA is anti-RU extremists', 'URW: Russia is the Victim: Other']"
